Mix Name,Mix Photo,Mix Description,Wine Name,Cheese Name,Meal Name
Sunset Trio,https://raw.githubusercontent.com/algosup/2024-2025-project-5-bubble-intermarche-team-4/refs/heads/main/data/images-mix/Sunset_trio.png, "A fresh and colorful mix ideal for summer evenings and aperitifs.",Domaine de Lagoy Blanc Cuvée Classique Bio,Tome de Provence,Tartare de saumon
Autumn Feast,https://raw.githubusercontent.com/algosup/2024-2025-project-5-bubble-intermarche-team-4/refs/heads/main/data/images-mix/Autumn_feast.png,"Robust and warming, perfect for cozy fall dinners with friends.",AOP Côtes-du-Rhône Rouge Tradition,Mozza di Bufala Bonbon 200 g,Coq au Vin
Spring Garden,https://raw.githubusercontent.com/algosup/2024-2025-project-5-bubble-intermarche-team-4/refs/heads/main/data/images-mix/Spring_garden.png,"Light and floral, a great pairing for brunches and garden parties.",AOC Ventoux Mot d'Excuse Rosé,Saint-Marcellin en céramique,Ratatouille
Winter Comfort,https://raw.githubusercontent.com/algosup/2024-2025-project-5-bubble-intermarche-team-4/refs/heads/main/data/images-mix/Winter_comfort.png,"Hearty and bold, excellent for cold evenings and festive meals.",Entre Terres Lumières Ventoux Blanc,Picodon AOP Mère Richard,Choucroute garnie
Bistro Classic,https://raw.githubusercontent.com/algosup/2024-2025-project-5-bubble-intermarche-team-4/refs/heads/main/data/images-mix/Bistro_classic.png,"A timeless French combo, great for weekend lunches or casual dinners.",Val de L'Oule Blanc Plaisir,Faisselle P&C Saint-Marcellin IGP 2×80 g,Blanquette de veau
Elegant Escape,https://raw.githubusercontent.com/algosup/2024-2025-project-5-bubble-intermarche-team-4/refs/heads/main/data/images-mix/Elegant_escape.,"Sophisticated and balanced, ideal for date nights or special occasions.",Expert Club Costières-de-Nîmes Rouge,"Roitelet Brie 3,150 kg",Magret de canard
Mountain Picnic,https://raw.githubusercontent.com/algosup/2024-2025-project-5-bubble-intermarche-team-4/refs/heads/main/data/images-mix/Quiche_Lorraine.jpg,"Rustic and rich, perfect after a hike or alpine picnic.",Botter Prosecco Spumante DOC,½ Reblochon AOP 250 g,Quiche Lorraine
